,name,orcid,link,title,date,journal
0,Rafał Aleksandrowicz,http://orcid.org/0000-0003-4895-5415,empty,A practical approach to individualisation of the learning process,2020-04,Hejnał Oświatowy
1,Rafał Aleksandrowicz,http://orcid.org/0000-0003-4895-5415,empty, Book review: Scientific writing of students. ,2020-02,Hejnał Oświatowy
2,Rafał Aleksandrowicz,http://orcid.org/0000-0003-4895-5415,https://doi.org/10.14632/nis.2019.69.35,Global and Polisensoric Strengthening of Primary School Students in Initial Classes,2019-11-07,Nauczyciel i Szkoła
3,Adam Anczyk,https://orcid.org/0000-0001-6906-3104,https://doi.org/10.1177/0084672421994199,Three decades of the Polish psychology of religion (1989–2020),2021-07-05,Archive for the Psychology of Religion
4,Adam Anczyk,https://orcid.org/0000-0001-6906-3104,https://doi.org/10.4467/25444972smpp.20.017.12333,Polscy migranci i norweska służba zdrowia: badanie pilotażowe,2020,Studia Migracyjne – Przegląd Polonijny
5,Adam Anczyk,https://orcid.org/0000-0001-6906-3104,https://doi.org/10.1177/0084672420926259,Which psychology(ies) serves us best? Research perspectives on the psycho-cultural interface in the psychology of religion(s),2020-11-07,Archive for the Psychology of Religion
6,Adam Anczyk,https://orcid.org/0000-0001-6906-3104,https://doi.org/10.1080/0048721x.2019.1681078,Psychology of religion(s) and religious studies: into the future,2020-01-02,Religion
7,Adam Anczyk,https://orcid.org/0000-0001-6906-3104,https://doi.org/10.1080/10508619.2019.1687197,The Replication Crisis and Qualitative Research in the Psychology of Religion,2019-10-02,The International Journal for the Psychology of Religion
8,Adam Anczyk,https://orcid.org/0000-0001-6906-3104,https://doi.org/10.5604/01.3001.0013.2969,Wielokulturowość nowym wyzwaniem etycznym w pracy polskich psychologów szkolnych i akademickich,2019-06-30,Psychologia wychowawcza
9,Adam Anczyk,https://orcid.org/0000-0001-6906-3104,https://doi.org/10.5604/01.3001.0013.2968,Wielokulturowość w pracy psychologa: etyka i praktyka w kontekście diagnozy klinicznej i pracy terapeutycznej,2019-06-30,Psychologia wychowawcza
10,Adam Anczyk,https://orcid.org/0000-0001-6906-3104,https://doi.org/10.4467/20843860pk.18.015.9193,Konceptualizacje snu i marzeń sennych w kulturach indygenicznych : perspektywa psycho-kulturowa,2018,Przegląd kulturoznawczy
11,Adam Anczyk,https://orcid.org/0000-0001-6906-3104,https://doi.org/10.1080/01416200.2016.1209457,Religious discrimination discourse in the mono-cultural school: the case of Poland,2018,British Journal of Religious Education
12,Adam Anczyk,https://orcid.org/0000-0001-6906-3104,empty,Pluralism of methods in religious studies: A swot analysis,2017,Anthropos
13,Adam Anczyk,https://orcid.org/0000-0001-6906-3104,empty,The Sacred Texts Experiment : images of religious Others and their role in forming attitudes towards accepting Muslim refugees in Poland ,2017,Studia Migracyjne - Przegląd Polonijny
14,Adam Anczyk,https://orcid.org/0000-0001-6906-3104,https://doi.org/10.1558/pome.33300,Women of power: The image of the witch and feminist movements in Poland,2017,Pomegranate
15,Jacek Bielas,https://orcid.org/0000-0001-9771-4162,https://doi.org/10.35765/rfi.2021.2702.15,Inhibition of Return (IOR): Is it Consciousness of an Object without Attention or Attention without an Object and Consciousness?,2021-12-30,Rocznik Filozoficzny Ignatianum
16,Jacek Bielas,https://orcid.org/0000-0001-9771-4162,https://doi.org/10.1177/0033294119900348,Beta Neurofeedback Training Improves Attentional Control in the Elderly,2021-02-14,Psychological Reports
17,Jacek Bielas,https://orcid.org/0000-0001-9771-4162,https://doi.org/10.1111/ejn.14773,Preparation of saccade sequences and eye programming affect endogenous covert attention,2020-09-22,European Journal of Neuroscience
18,Jacek Bielas,https://orcid.org/0000-0001-9771-4162,https://doi.org/10.1177/0959354319834672,Is the premotor theory of attention essentially about pre-reflective intentionality?,2019-12-21,Theory & Psychology
19,Jacek Bielas,https://orcid.org/0000-0001-9771-4162,https://doi.org/10.1007/s00221-019-05537-8,The gap effect reduces both manual and saccadic inhibition of return (IOR),2019-07,Experimental Brain Research
20,Jacek Bielas,https://orcid.org/0000-0001-9771-4162,https://doi.org/10.1016/j.neulet.2017.11.035,Is saccade preparation required for inhibition of return (IOR)?,2018-02,Neuroscience Letters
21,Jacek Bielas,https://orcid.org/0000-0001-9771-4162,empty,The view from within the brain: Does neurofeedback close the gap? ,2017,Journal of Consciousness Studies
22,Stefan Frydrychowicz,https://orcid.org/0000-0001-8318-6880,https://doi.org/10.14746/cis.2020.50.2,Komunikacja interpersonalna w interakcjach społecznych,2020-12-15,Człowiek i Społeczeństwo
23,Tomasz Grzegorek,https://orcid.org/0000-0002-8317-4158,empty,Czy jest jakiś pożytek ze studenckiej ankiety do ewaluacji zajęć?,2021-02,Nauka
24,Halina Grzymała-Moszczyńska,https://orcid.org/0000-0003-2751-3204,https://doi.org/10.4467/25444972smpp.20.017.12333,Polscy migranci i norweska służba zdrowia: badanie pilotażowe,2020,Studia Migracyjne – Przegląd Polonijny
25,Halina Grzymała-Moszczyńska,https://orcid.org/0000-0003-2751-3204,https://doi.org/10.1177/0084672420926259,Which psychology(ies) serves us best? Research perspectives on the psycho-cultural interface in the psychology of religion(s),2020-11-07,Archive for the Psychology of Religion
26,Halina Grzymała-Moszczyńska,https://orcid.org/0000-0003-2751-3204,https://doi.org/10.1080/0048721x.2019.1681078,Psychology of religion(s) and religious studies: into the future,2020-01-02,Religion
27,Halina Grzymała-Moszczyńska,https://orcid.org/0000-0003-2751-3204,https://doi.org/10.1080/10508619.2019.1687197,The Replication Crisis and Qualitative Research in the Psychology of Religion,2019-10-02,The International Journal for the Psychology of Religion
28,Halina Grzymała-Moszczyńska,https://orcid.org/0000-0003-2751-3204,empty,Pluralism of Methods in Religious Studies,2017,Anthropos
29,Halina Grzymała-Moszczyńska,https://orcid.org/0000-0003-2751-3204,empty,Psychological and educational counseling centers in the face of children and adolescents immigrating back to Poland,2017,Psychologia Wychowawcza
30,Halina Grzymała-Moszczyńska,https://orcid.org/0000-0003-2751-3204,empty,The sacred text experiment : images of religious others and their role in forming attitudes towards accepting Muslim refugees in Poland,2017,Przegląd Migracyjny
31,Ewa Jaglarz,https://orcid.org/0000-0001-8754-8770,empty,Aspiracje i plany życiowe młodzieży gimnazjum integracyjnego,2018,Niepełnosprawność i Rehabilitacja. nr 4
32,Ewa Jaglarz,https://orcid.org/0000-0001-8754-8770,empty,Jakościowa charakterystyka stylu zarządzania miejscem pracy ze względu na warunki sprzyjające zatrudnianiu osób z niepełnosprawnością,2018,Niepełnosprawność. Dyskursy pedagogiki specjalnej
33,Ewa Jaglarz,https://orcid.org/0000-0001-8754-8770,empty,Praca i jej znaczenie dla osób z niepełnosprawnością. Prawny i społeczny wymiar funkcjonowania zawodowego osób z niepełnosprawnością,2017,"Studia Socialia Cracoviensia 9(2017) nr 2 (17),"
34,Kamil Jezierski,https://orcid.org/0000-0001-6935-4710,https://doi.org/10.4467/20843879pr.20.015.12270,"Recenzja książki: R. J. Sternberg & J. Glück (Eds.) (2019), The Cambridge handbook of wisdom. Cambridge University Press",2020,Psychologia Rozwojowa
35,Kamil Jezierski,https://orcid.org/0000-0001-6935-4710,https://doi.org/10.4467/20843879pr.20.027.13435,Specyfika rozwojowa struktury pamięci dzieciństwa w biegu dorosłego życia – wyniki badań narracyjnych,2020,Psychologia Rozwojowa
36,Kamil Jezierski,https://orcid.org/0000-0001-6935-4710,empty,"Sprawozdanie z VII Konferencji Psychologii Narracyjnej: „Narracja i Rozwój”, 27-29 września 2018 r., Kazimierz Dolny ",2019,Psychologia Rozwojowa
37,Kamil Jezierski,https://orcid.org/0000-0001-6935-4710,https://doi.org/10.35765/hw.2019.1848.02,Wspólne wychowanie po rozwodzie jako wyzwanie współczesności,2019-12-30,Horyzonty Wychowania
38,Agnieszka Krawczyk,https://orcid.org/0000-0003-3855-4490,https://doi.org/10.17399/hw.2017.163809,Location of Pain Control and Fatigue in Oncological Patients at Various Stages of Treatment.,2017,Horizons of Education
39,Krzysztof Kwapis,https://orcid.org/0000-0002-0359-6386,https://doi.org/10.24425/ppb.2021.137890,The Identity Dynamics Questionnaire (IDQ): Operationalization and Verification of the Identity Dynamics Model,2021,Polish Psychological Bulletin
40,Krzysztof Kwapis,https://orcid.org/0000-0002-0359-6386,empty,"The quality of life , meaning in life , positive orientation to life and gratitude of Catholic seminarians in Poland : A comparative analysis",2021,Archive for the Psychology of Religion
41,Krzysztof Kwapis,https://orcid.org/0000-0002-0359-6386,https://doi.org/10.12740/pp/onlinefirst/139887,Parental attitudes and intensification of borderline personality traits: the mediational role of self-control and identity integration,2021-10-04,Psychiatria Polska
42,Krzysztof Kwapis,https://orcid.org/0000-0002-0359-6386,empty,The Development and Psychometric Properties of the Polish Version of the Self-Control Scale,2020,"Annales Universitatis Mariae Curie-Skłodowska, Sectio J – Paedagogia-Psychologia"
43,Łukasz Michalczyk,https://orcid.org/0000-0002-3174-0832,https://doi.org/10.1111/ejn.14773,Preparation of saccade sequences and eye programming affect endogenous covert attention,2020-09-22,European Journal of Neuroscience
44,Łukasz Michalczyk,https://orcid.org/0000-0002-3174-0832,https://doi.org/10.1177/0033294119900348,Beta Neurofeedback Training Improves Attentional Control in the Elderly,2020-01-14,Psychological Reports
45,Łukasz Michalczyk,https://orcid.org/0000-0002-3174-0832,https://doi.org/10.1007/s00221-019-05537-8,The gap effect reduces both manual and saccadic inhibition of return (IOR),2019-07-05,Experimental Brain Research
46,Łukasz Michalczyk,https://orcid.org/0000-0002-3174-0832,https://doi.org/10.1177/0959354319834672,Is the premotor theory of attention essentially about pre-reflective intentionality?,2019-03-21,Theory & Psychology
47,Łukasz Michalczyk,https://orcid.org/0000-0002-3174-0832,empty,The view from within the brain: Does neurofeedback close the gap?,2017-01-01,Journal of Consciousness Studies
48,Krzysztof Waldemar Nowakowski,https://orcid.org/0000-0002-2982-5124,https://doi.org/10.12740/pp/onlinefirst/118139,"Psychopathic traits, psychological resilience and coping with stress in socially maladjusted youth",2021-10-31,Psychiatria Polska
49,Jacek Prusak,https://orcid.org/0000-0002-3204-2251,https://doi.org/10.12740/pp/onlinefirst/139887,Parental attitudes and intensification of borderline personality traits: the mediational role of self-control and identity integration,2021-10-04,Psychiatria Polska
50,Jacek Prusak,https://orcid.org/0000-0002-3204-2251,https://doi.org/10.3390/rel12070532,The Experience and Correlates of God’s Silence among Christians,2021-07-14,Religions
51,Jacek Prusak,https://orcid.org/0000-0002-3204-2251,https://doi.org/10.1177/0084672420983488,"The quality of life, meaning in life, positive orientation to life and gratitude of Catholic seminarians in Poland: A comparative analysis",2021-03,Archive for the Psychology of Religion
52,Jacek Prusak,https://orcid.org/0000-0002-3204-2251,https://doi.org/10.4467/25444972smpp.20.017.12333,Polscy migranci i norweska służba zdrowia: badanie pilotażowe,2020,Studia Migracyjne – Przegląd Polonijny
53,Jacek Prusak,https://orcid.org/0000-0002-3204-2251,https://doi.org/10.12740/pp/118599,"Paraphilias among Roman Catholic priests: what we know, and do not know, about sexual clergy-abusers of minors",2020-06-30,Psychiatria Polska
54,Jacek Prusak,https://orcid.org/0000-0002-3204-2251,https://doi.org/10.1080/10508619.2019.1687197,The Replication Crisis and Qualitative Research in the Psychology of Religion,2019-10-02,The International Journal for the Psychology of Religion
55,Irmina Barbara Rostek,https://orcid.org/0000-0002-8254-8867,https://doi.org/10.35765/hw.2168,Editorial: Daily life during a pandemic,2021-10-26,Horyzonty Wychowania
56,Irmina Barbara Rostek,https://orcid.org/0000-0002-8254-8867,https://doi.org/10.35765/hw.2167,Edytorial: Codzienność w dobie pandemii,2021-10-26,Horyzonty Wychowania
57,Irmina Barbara Rostek,https://orcid.org/0000-0002-8254-8867,https://doi.org/10.35765/hw.2075,Nastrój i emocje Polaków podczas pandemii COVID-19,2021-05-19,Horyzonty Wychowania
58,Irmina Barbara Rostek,https://orcid.org/0000-0002-8254-8867,https://doi.org/10.35765/eetp.2019.1454.03,Narratives in STEM Education,2020-01-29,Edukacja Elementarna w Teorii i Praktyce
59,Irmina Barbara Rostek,https://orcid.org/0000-0002-8254-8867,https://doi.org/10.35765/hw.2019.1848.02,Wspólne wychowanie po rozwodzie jako wyzwanie współczesności,2019-12-30,Horyzonty Wychowania
60,Anna Schab-Przybycień,https://orcid.org/0000-0003-0520-3766,https://doi.org/10.1177/00846724211060391,Spiritual trauma as a manifestation of religious and spiritual struggles in female victims of sexual abuse in adolescence or young adulthood in the Catholic Church in Poland,2021-12-14,Archive for the Psychology of Religion
61,Anna Schab-Przybycień,https://orcid.org/0000-0003-0520-3766,https://doi.org/10.1111/ejn.14773,Preparation of saccade sequences and eye programming affect endogenous covert attention,2020-09,European Journal of Neuroscience
62,Katarzyna Sikora,https://orcid.org/0000-0002-5693-6639,https://doi.org/10.3389/fpsyg.2018.01899,	Placebo Groups in Research on the Effectiveness of ABA Therapeutic Techniques,2018-09,Frontiers in Psychology
63,Jerzy Smoleń,https://orcid.org/0000-0003-1655-1248,https://doi.org/10.18794/aams/137951,Sleep quality and depressive disorders among priests of the Archdiocese of Katowice,2021-10-25,Annales Academiae Medicae Silesiensis
64,Jerzy Smoleń,https://orcid.org/0000-0003-1655-1248,https://doi.org/10.21852/sem.2019.2.08,Pielgrzymowanie jako czynnik rozwoju człowieka,2019-09,Seminare. Poszukiwania naukowe
65,Małgorzata Steć,https://orcid.org/0000-0002-1841-9542,https://doi.org/10.4467/20843879pr.21.020.15221,Znaczenie podmiotu i jego wartości,2021-12-23,Psychologia Rozwojowa
66,Małgorzata Steć,https://orcid.org/0000-0002-1841-9542,https://doi.org/10.4467/20843879pr.20.023.13160,"Sprawozdanie z 14. Międzynarodowego Sympozjum Moral Competence: Its Nature, Relevance, and Education",2020,Psychologia Rozwojowa
67,Małgorzata Steć,https://orcid.org/0000-0002-1841-9542,https://doi.org/10.14746/eip.2018.2.8,University Students’ vs. Lay People’s Perspectives on Organ Donation and Improving Health Communication in Poland,2019-02-08,ETHICS IN PROGRESS
68,Małgorzata Steć,https://orcid.org/0000-0002-1841-9542,https://doi.org/10.14746%2Ffped.2017.6.2.21,Dlaczego sesja KMDD®jest „szyta na miarę” dla naszego mózgu? Stymulacja kompetencji moralnej z perspektywy neuropsychologicznej,2017-01-01,Filozofia Publiczna i Edukacja Demokratyczna
69,Małgorzata Steć,https://orcid.org/0000-0002-1841-9542,https://doi.org/10.14746%2Feip.2017.2.4,Is  The  Stimulation  of  Moral  Competence  with  KMDD® Well-suitedfor   Our   Brain?   A   Perspective   From Neuroethics,2017-01-01,Ethics in Progress
70,Beata Winnicka,https://orcid.org/0000-0002-0392-6699,https://doi.org/10.4467/20843879pr.19.025.11731,"Recenzja książki: Mark H. Johnson, Michelle de Haan (2018), Neurokognitywistyka rozwoju. Wprowadzenie. Gdańsk: Harmonia Universalis",2019,Psychologia Rozwojowa