,name,orcid,link,title,date,journal
208,Katarzyna Walęcka-Matyja,https://orcid.org/0000-0001-8222-729X,empty,Struktura rodziny młodych dorosłych a jakość ich bliskich związków interpersonalnych.,2021-01-24,Problemy Opiekuńczo-Wychowawcze
209,Katarzyna Walęcka-Matyja,https://orcid.org/0000-0001-8222-729X,https://doi.org/10.34766/fetr.v41i1.231,Familizm a orientacja wspólnotowa i materializm w okresie dorosłości,2020,Kwartalnik Naukowy Fides et Ratio
210,Katarzyna Walęcka-Matyja,https://orcid.org/0000-0001-8222-729X,https://doi.org/10.34766/fetr.v42i2.279,The polish version of the Affectionate Communication Index. Preliminary report,2020,Kwartalnik Naukowy Fides et Ratio
211,Katarzyna Walęcka-Matyja,https://orcid.org/0000-0001-8222-729X,https://doi.org/10.12740/pp/108993,"Familism – the concept, measure and importance for mental health",2020-08-31,Psychiatria Polska
212,Katarzyna Walęcka-Matyja,https://orcid.org/0000-0001-8222-729X,empty,Polish version of the Affectionate Communication Index. Preliminary report. ,2020-07-12,"Kwartalnik Naukowy Fides et Ratio. Porozumiewanie się, dialog, komunikacja. Ujęcie integralne"
213,Katarzyna Walęcka-Matyja,https://orcid.org/0000-0001-8222-729X,empty,Familizm a orientacja wspólnotowa i materializm w okresie dorosłości. ,2020-05-08,"Kwartalnik Naukowy Fides et Ratio. Miłość, małżeństwo, rodzina. Ujęcie interdyscyplinarne, 1, 241-259."
214,Katarzyna Walęcka-Matyja,https://orcid.org/0000-0001-8222-729X,empty,Predykcyjna rola retrospektywnej oceny postaw rodzicielskich ojca a perfekcjonizm i samoocena kobiet w okresie wczesnej dorosłości,2019,Psychiatria Polska
215,Katarzyna Walęcka-Matyja,https://orcid.org/0000-0001-8222-729X,https://doi.org/10.12740/pp/89639,Predykcyjna rola retrospektywnej oceny postaw rodzicielskich ojca a perfekcjonizm i samoocena kobiet w okresie wczesnej dorosłości,2019,Psychiatria Polska
216,Katarzyna Walęcka-Matyja,https://orcid.org/0000-0001-8222-729X,empty,Psychologiczne predyktory zadowolenia z bliskiego związku interpersonalnego. Rola komunikacji emocjonalnej,2019,Kwartalnik Naukowy Fides et Ratio
217,Katarzyna Walęcka-Matyja,https://orcid.org/0000-0001-8222-729X,empty,Psychological predictors of satisfaction with a close interpersonal relationship. The role of emotional communication,2019-08-23,Kwartalnik Naukowy Fides et Ratio
218,Katarzyna Walęcka-Matyja,https://orcid.org/0000-0001-8222-729X,empty,Job satisfaction and mental health among young adults – a role of a sibling relationship. ,2019-05-28,Kwartalnik Naukowy Fides et Ratio
219,Katarzyna Walęcka-Matyja,https://orcid.org/0000-0001-8222-729X,empty,Loneliness and coping with stress in only children and persons with siblings in early adulthood. ,2019-05-28,Kwartalnik Naukowy Fides et Ratio
220,Katarzyna Walęcka-Matyja,https://orcid.org/0000-0001-8222-729X,https://doi.org/10.12740/app/97227,Personality and interpersonal sibling relationships in early adulthood - causal analysis,2018,Archives of Psychiatry and Psychotherapy
221,Katarzyna Walęcka-Matyja,https://orcid.org/0000-0001-8222-729X,empty,Personality and interpersonal sibling relationships in early adulthood – causal analysis. ,2018-12-17,"K.Walęcka-Matyja (2018). Personality and interpersonal sibling relationships in early adulthood – causal analysis. Archives of Psychiatry and Psychotherapy, 4: 67–75. doi: 10.12740/APP/97227"
222,Katarzyna Walęcka-Matyja,https://orcid.org/0000-0001-8222-729X,https://doi.org/10.12740/app/76339,Relationship with siblings as a predictor of empathy and humor styles in early adulthood,2017,Archives of Psychiatry and Psychotherapy
223,Katarzyna Walęcka-Matyja,https://orcid.org/0000-0001-8222-729X,empty,Relationships with siblings as a predictor of empathy and styles of sense of humor in early adulthood,2017,"Archives of Psychiatry and Psychotheraphy, 3, 43-51. doi: 10.12740/APP/76339"
224,Monika Wróbel,https://orcid.org/0000-0002-4326-6154,https://doi.org/10.1007/s11031-021-09897-z,The “Big Two” and socially induced emotions: Agency and communion jointly influence emotional contagion and emotional mimicry,2021-10-18,Motivation and Emotion
225,Monika Wróbel,https://orcid.org/0000-0002-4326-6154,https://doi.org/10.1016/j.paid.2019.109803,"Self-esteem, gender, and emotional contagion: What predicts people’s proneness to “catch” the feelings of others?",2020-04,Personality and Individual Differences
226,Monika Wróbel,https://orcid.org/0000-0002-4326-6154,https://doi.org/10.18290/rpsych.2019.22.1-6,Emotional reactions to dynamic morphed facial expressions: A new method to induce emotional contagion,2019,Roczniki Psychologiczne
227,Monika Wróbel,https://orcid.org/0000-0002-4326-6154,https://doi.org/10.18290/rpsych.2019.22.1-1,Emotions are not a private matter: Introduction to a special issue on emotions in interpersonal relationships,2019,Roczniki Psychologiczne
228,Monika Wróbel,https://orcid.org/0000-0002-4326-6154,https://doi.org/10.1007/s10862-019-09720-7,Measuring Positive and Negative Affect in a School-Based Sample: A Polish Version of the PANAS-C,2019-12-01,Journal of Psychopathology and Behavioral Assessment
229,Monika Wróbel,https://orcid.org/0000-0002-4326-6154,https://doi.org/10.1515/humor-2018-0023,Moral judgment of disparagement humor,2019-10-25,HUMOR
230,Monika Wróbel,https://orcid.org/0000-0002-4326-6154,https://doi.org/10.1080/02699931.2019.1611543,Mimicking and sharing emotions: a re-examination of the link between facial mimicry and emotional contagion,2019-05-09,
231,Monika Wróbel,https://orcid.org/0000-0002-4326-6154,https://doi.org/10.1177/1745691618808523,Broadening the Perspective on Emotional Contagion and Emotional Mimicry: The Correction Hypothesis,2019-05-07,Perspectives on Psychological Science
232,Monika Wróbel,https://orcid.org/0000-0002-4326-6154,https://doi.org/10.1027/1015-5759/a000315,A Cross-Cultural Validation of the Implicit Positive and Negative Affect Test (IPANAT): Results From Ten Countries Across Three Continents,2018,European Journal of Psychological Assessmen
233,Monika Wróbel,https://orcid.org/0000-0002-4326-6154,https://doi.org/10.1177/0265407517710820,I can see that you’re happy but you’re not my friend Relationship closeness and affect contagion,2018-08-01,Journal of Social and Personal Relationships
234,Monika Wróbel,https://orcid.org/0000-0002-4326-6154,https://doi.org/10.7366/1896180020174303,Czy uśmiech ładnych ludzi jest bardziej zaraźliwy? Atrakcyjność fizyczna jako moderator zarażania afektywnego = Are smiles of attractive people more contagious? Physical attractiveness moderates affect contagion,2017,PSYCHOLOGIA SPOLECZNA
235,Monika Wróbel,https://orcid.org/0000-0002-4326-6154,https://doi.org/10.1080/01973533.2016.1227709,Do We Feel the Same Way If We Think the Same Way? Shared Attitudes and the Social Induction of Affect,2017,Basic and Applied Social Psychology
236,Magdalena Maria Zadworna,https://orcid.org/0000-0002-0585-019X,https://doi.org/10.34766/fetr.v47i3.765,Evaluation of a pedagogical e-tool for promoting students’ well-being: The perspective of future prevention providers,2021-09-30,Kwartalnik Naukowy Fides et Ratio
237,Magdalena Maria Zadworna,https://orcid.org/0000-0002-0585-019X,https://doi.org/10.1007/s10389-020-01301-3,Health behavior among Polish institutionalized older adults: the effect of resiliency mediated by satisfaction with life,2021-06-05,Journal of Public Health
238,Magdalena Maria Zadworna,https://orcid.org/0000-0002-0585-019X,https://doi.org/10.1016/j.explore.2019.07.016,"Spirituality, satisfaction with life and health-related behavior of older residents of long-term care institutions—a pilot study",2020,Explore
239,Magdalena Maria Zadworna,https://orcid.org/0000-0002-0585-019X,https://doi.org/10.1016/j.archger.2020.104126,Healthy aging and the University of the Third Age – Health behavior and subjective health outcomes in older adults,2020-09,Archives of Gerontology and Geriatrics
240,Magdalena Maria Zadworna,https://orcid.org/0000-0002-0585-019X,https://doi.org/10.1007/s12144-019-00380-0,Psychometric properties of the Developmental Tasks Questionnaire for Seniors,2020-08-22,Current Psychology
241,Magdalena Maria Zadworna,https://orcid.org/0000-0002-0585-019X,https://doi.org/10.12775/pbe.2020.007,"Stress and Coping Strategies Among Participants of Stress Management Interventions at the Science, Technology and Art Festival",2020-06-30,Przegląd Badań Edukacyjnych
242,Magdalena Maria Zadworna,https://orcid.org/0000-0002-0585-019X,https://doi.org/10.4415/ann_19_02_02,An international study of middle school students' preferences about digital interactive education activities for promoting psychological well-being and mental health,2019,Annali dell'Istituto Superiore di Sanita
243,Magdalena Maria Zadworna,https://orcid.org/0000-0002-0585-019X,https://doi.org/10.14746/se.2019.54.13,Wybrane aspekty dobrostanu psychicznego uczniów na różnych etapach edukacji. Doniesienia wstępne [Selected Aspects of the Psychological Wellbeing  of  Students  at  Different  Stages  of  Education.  Preliminary  Report].,2019-09-15,Studia Edukacyjne
244,Magdalena Maria Zadworna,https://orcid.org/0000-0002-0585-019X,https://doi.org/10.12775/pbe.2019.002,Satisfaction with Life in Old Age – the Role of Developmental Tasks Attainment and Resiliency,2019-05-31,Przegląd Badań Edukacyjnych
245,Magdalena Maria Zadworna,https://orcid.org/0000-0002-0585-019X,empty,Bilans życiowy a potraumatyczny wzrost u osób starszych zmagających się z przewlekłymi chorobami somatycznymi - mediacyjna rola prężności = Life outcome and posttraumatic growth in the elderly struggling with chronic somatic diseases - the meditating role of resiliency,2018,Gerontologia Polska
246,Magdalena Maria Zadworna,https://orcid.org/0000-0002-0585-019X,https://doi.org/10.5114/hpc.2018.76519,Health as a source of happiness and health-related behaviour of young people,2018,Health Problems of Civilization
247,Magdalena Maria Zadworna,https://orcid.org/0000-0002-0585-019X,https://doi.org/10.5114/hpc.2018.74184,Specificity of health-related behaviours in middle and late adulthood = Specyfika zachowań zdrowotnych osób w okresie średniej i późnej dorosłości,2018,Health Problems of Civilization
248,Magdalena Maria Zadworna,https://orcid.org/0000-0002-0585-019X,https://doi.org/10.1016/j.ienj.2018.02.004,The role of resiliency and coping strategies in occurrence of positive changes in medical rescue workers,2018,International Emergency Nursing
249,Magdalena Maria Zadworna,https://orcid.org/0000-0002-0585-019X,empty,Psychological wellbeing in the teaching profession,2018-12-01,Edukacja Dorosłych
250,Magdalena Maria Zadworna,https://orcid.org/0000-0002-0585-019X,https://doi.org/10.12775/pbe.2018.021,The Subjective Mental Well-Being of School-Age Children – Educational and Prophylactic Challenges,2018-11-29,Przegląd Badań Edukacyjnych
251,Magdalena Maria Zadworna,https://orcid.org/0000-0002-0585-019X,empty,Developmental tasks' attainment in late adulthood - the construction of a new psychometric tool = Realizacja zadań rozwojowych w okresie późnej dorosłości - konstrukcja nowego narzędzia badawczego,2017,Gerontologia Polska
252,Magdalena Maria Zadworna,https://orcid.org/0000-0002-0585-019X,https://doi.org/10.18290/rpsych.2017.20.3-3pl,Pomiar zachowań zdrowotnych w okresie późnej dorosłości - Kwestionariusz Zachowań Zdrowotnych dla Seniorów = The measurement of health-related behavior in late adulthood: The Health-Related Behavior Questionnaire for Seniors,2017,Roczniki Psychologiczne
253,Magdalena Maria Zadworna,https://orcid.org/0000-0002-0585-019X,https://doi.org/10.18290/rpsych.2017.20.3-3en,The measurement of health-related behavior in late adulthood: The health-related behavior questionnaire for seniors,2017,Roczniki Psychologiczne
254,Marta Renata Znajmiecka,https://orcid.org/0000-0002-4710-7871,empty,Analysis of the relationship between psychological gender and risk perception style and attitudes towards safety in a group of women and men,2020,nternational Journal of Occupational Safety and Ergonomics
255,Marta Renata Znajmiecka,https://orcid.org/0000-0002-4710-7871,empty,Analysis of the relationship between psychological gender and risk perception style and attitudes towards safety in a group of women and men.,2020,International Journal of Occupational Safety and Ergonomics
256,Marta Renata Znajmiecka,https://orcid.org/0000-0002-4710-7871,empty,Styl przywiązania a tolerancja niejednoznaczności w sytuacji podejmowania decyzji zawodowych przez młodych dorosłych. Mediacyjny efekt poczucia bezpieczeństwa,2020,Polskie Forum Psychologiczne
257,Marta Renata Znajmiecka,https://orcid.org/0000-0002-4710-7871,empty,Styl przywiązania a tolerancja niejednoznaczności w sytuacji podejmowania decyzji zawodowych przez młodych dorosłych. Mediacyjny efekt poczucia bezpieczeństwa,2020,Polskie Forum Psychologiczne
258,Marta Renata Znajmiecka,https://orcid.org/0000-0002-4710-7871,empty,Work safety climate. Comparison of selected occupational groups,2020,PLoS ONE
259,Marta Renata Znajmiecka,https://orcid.org/0000-0002-4710-7871,empty,Analiza różnic w postawach wobec bezpieczeństwa w pracy w kontekście postrzeganego dystansu wobec zagrożenia.,2019,Zarządzanie Zasobami Ludzkimi
260,Marta Renata Znajmiecka,https://orcid.org/0000-0002-4710-7871,empty,Analiza związku między perspektywą postrzegania czasu a prokrastynacją akademicką,2019,e-mentor
261,Marta Renata Znajmiecka,https://orcid.org/0000-0002-4710-7871,empty,Kwestionariusz postaw wobec bezpieczeństwa (KPwB) – konstrukcja i charakterystyka psychometryczna,2019,Zeszyty Naukowe Politechniki Łódzkiej Seria Organizacja i Zarządzanie
262,Marta Renata Znajmiecka,https://orcid.org/0000-0002-4710-7871,empty,Właściwości psychometryczne skróconej wersji Kwestionariusza Klimatu Bezpieczeństwa-50 (KKB-50),2019,Zeszyty Naukowe Politechniki Łódzkiej Seria Organizacja i Zarządzanie
263,Marta Renata Znajmiecka,https://orcid.org/0000-0002-4710-7871,empty,Podmiotowe wyznaczniki zachowań ryzykownych i agresywnych w grupie motocyklistów,2018,Zeszyty Naukowe Politechniki Śląskiej Seria Organizacja i Zarządzanie
264,Marta Renata Znajmiecka,https://orcid.org/0000-0002-4710-7871,empty,Behaviour-Based Safety (BBS): program modyfikacji zachowań niebezpiecznych w przedsiębiorstwie,2017,Bezpieczeństwo pracy – Nauka i Praktyka
265,Marta Renata Znajmiecka,https://orcid.org/0000-0002-4710-7871,https://doi.org/10.26485/spe/2017/105/11,Koszty zarządzania bezpieczeństwem pracy - badanie poziomu świadomości pracodawców = The Costs of Safety Management in the Perception of Employers - Research Report,2017,Studia Prawno-Ekonomiczne
266,Marta Renata Znajmiecka,https://orcid.org/0000-0002-4710-7871,empty,Pracownicza ocena klimatu bezpieczeństwa pracy i jej znaczenie dla ZZL. Kooperacyjny zakres działań w obszarze ZZL i BHP,2017,Zarządzanie Zasobami Ludzkimi
267,Marta Renata Znajmiecka,https://orcid.org/0000-0002-4710-7871,empty,Rola i znaczenie diagnozy potrzeb szkoleniowych w kontekście szkoleń z zakresu bezpieczeństwa i higieny pracy,2017,Organizacja i zarządzanie Zeszyty Naukowe Politechniki Łódzkiej
268,Marta Renata Znajmiecka,https://orcid.org/0000-0002-4710-7871,https://doi.org/10.15219/em66.1261,Academic procrastination - personal and family determinants,2017-01-11,e-mentor